{
  "schema": "changerail.maintenance-detector-result.v1",
  "id": "adapter-external",
  "status": "fail",
  "findings": [
    {
      "id": "external:fixture:docs",
      "severity": "major",
      "code": "external_fixture_finding",
      "message": "external producer fixture finding",
      "path": "docs/board-and-two-agent-feature-flow.md",
      "evidence": {
        "source_record": "fixtures/repository-knowledge/feedback/external-valid.json"
      }
    }
  ],
  "errors": []
}
